<?xml version="1.0" encoding="ISO-8859-1" ?>
<!DOCTYPE configuration PUBLIC "-//DEEPSEA//COASTAL configuration//EN" "https://deepseaplatform.github.io/coastal/coastal.dtd">
<configuration>
	<coastal>
		<main>Main</main>
		<target>Main</target>
		<trigger>Main.main(String)</trigger>
		<strategy>za.ac.sun.cs.coastal.strategy.pathbased.DepthFirstFactory</strategy>
		<observer>za.ac.sun.cs.coastal.observers.AssertControllerFactory</observer>
		<trace-all>false</trace-all>
		<echo-output>true</echo-output>
		<draw-paths>false</draw-paths>
		<concrete-values>true</concrete-values>
		<limits>
			<runs>0</runs>
			<time>0</time>
			<path>0</path>
			<conjuncts>0</conjuncts>
		</limits>
	</coastal>
</configuration>
